"","product","helpful_count","total_comments","url","review_country","reviewed_at","review_text","review_rating","product_company","profile_name","review_title","review"
"1712","Apple iPhone XR (64GB) - Black",0,0,"url 172","India",2019-11-28,"Best quality","5 stars","Apple","Aju Aniyan","Awesome",5
"1713","Apple iPhone XR (64GB) - Black",0,0,"url 172","India",2019-11-10,"Great mobile","5 stars","Apple","Aravind Prakash","Loving it",5
"1714","Apple iPhone XR (64GB) - Black",0,0,"url 172","India",2019-11-18,"Overall Good","5 stars","Apple","Amazon Customer","Iphone XR",5
"1715","Apple iPhone XR (64GB) - Black",0,0,"url 172","India",2019-10-11,"Bought this phone and used for a week. Worth product and lovely upgrade from iPhone 6+","5 stars","Apple","Karthikeyan","Great Product",5
"1716","Apple iPhone XR (64GB) - Black",0,0,"url 172","India",2020-02-29,"Excellent product.  Ease of use and good features with iOS reliability","5 stars","Apple","Amazon Customer","Excellent product",5
"1717","Apple iPhone XR (64GB) - Black",0,0,"url 172","India",2019-11-14,"Product delivery was good was expecting much more safer but, its ok!","4 stars","Apple","Sharad Malani","Good quality",4
"1718","Apple iPhone XR (64GB) - Black",0,0,"url 172","India",2019-11-04,"Great display... great camera in natural light... avg performance in low light.... amazing battery life....  amazing looks....","5 stars","Apple","Satyam","A phone with flaws...",5
"1719","Apple iPhone XR (64GB) - Black",1,0,"url 172","India",2019-10-20,"Good phone.","5 stars","Apple","RamKumar","Worth the buy",5
"1720","Apple iPhone XR (64GB) - Black",0,0,"url 172","India",2019-09-12,"Great","5 stars","Apple","Amazon Customer","Great",5
"1721","Apple iPhone XR (64GB) - Black",1,0,"url 173","India",2019-10-02,"Xr is good phone","5 stars","Apple","Deepak","Good product and fast delivery",5
"1722","Apple iPhone XR (64GB) - Black",0,0,"url 173","India",2019-10-14,"All good less weight","5 stars","Apple","Bibhu","Good buy",5
"1723","Apple iPhone XR (64GB) - Black",0,0,"url 173","India",2020-01-25,"Iphone means Iphone. first time i switch on iphone, what an experience..i bought at 48000 for 128 xr, go for it......","5 stars","Apple","kuldeep singh","iPhone means iPhone, no need to review",5
"1724","Apple iPhone XR (64GB) - Black",0,0,"url 173","India",2019-11-01,"I have to unnecessarily visit the apple service center multiple times because i have been delivered a faulty product.","1 star","Apple","Nachiket","Given Faulty piece which shutdown after using for a day",1
"1725","Apple iPhone XR (64GB) - Black",0,0,"url 173","India",2019-11-04,"Apple XR is the best budget iPhone.","5 stars","Apple","Abhijeet S.","XR Ricks....",5
"1726","Apple iPhone XR (64GB) - Black",1,0,"url 173","India",2020-02-29,"This is good iPhone on this prices","5 stars","Apple","MD adeeb","This good phone",5
"1727","Apple iPhone XR (64GB) - Black",0,0,"url 173","India",2019-10-03,"Good phone from Apple, expectation fulfilled","5 stars","Apple","Supro","Brilliant Product",5
"1728","Apple iPhone XR (64GB) - Black",0,0,"url 173","India",2019-11-14,"Awesome phone","5 stars","Apple","Vipul Vadoliya","Best price",5
"1729","Apple iPhone XR (64GB) - Black",1,0,"url 173","India",2019-10-18,"I got it for 42999 & it's awesome.","5 stars","Apple","Manu R Das","Awesome product",5
"1730","Apple iPhone XR (64GB) - Black",0,0,"url 173","India",2019-07-24,"Like","5 stars","Apple","Sudarshan kumar","Nice",5
"1731","Apple iPhone XR (64GB) - Black",0,0,"url 174","India",2019-12-05,"I phone XR is one of the best buy after the price cut. it has a excellent battery backup & camera is amazing","5 stars","Apple","Syed Ayaz","Battery Champ",5
"1732","Apple iPhone XR (64GB) - Black",0,0,"url 174","India",2019-10-06,"Very good n apt to its name iPhone","5 stars","Apple","Amazon Customer","Perfect phone",5
"1733","Apple iPhone XR (64GB) - Black",0,0,"url 174","India",2019-11-22,"My First iPhone. Moved from OP 6T to iPhone Xr. Best Ever Experience.","5 stars","Apple","jagadeesh","Perfectly Packed iPhone",5
"1734","Apple iPhone XR (64GB) - Black",0,0,"url 174","India",2019-11-14,"Nice","5 stars","Apple","Tushar Kapat","Nice",5
"1735","Apple iPhone XR (64GB) - Black",0,0,"url 174","India",2019-12-31,"We are facing touch screen issue in the iPhone it's not even 20 days completed to the phone . I am putting it for replacement","3 stars","Apple","Ranveer singh","Touch screen issue",3
"1736","Apple iPhone XR (64GB) - Black",0,0,"url 174","India",2019-10-05,"The notch is a bit of a distraction while watching videos on full screen.. but it grows over you after something days of use","5 stars","Apple","Uday Kiran L","Definitely worthy it",5
"1737","Apple iPhone XR (64GB) - Black",0,0,"url 174","India",2019-11-07,"Regret to buy this after launch of iphone 11 in same price ...","4 stars","Apple","KARTIK","Good iphone before release of iPhone 11",4
"1738","Apple iPhone XR (64GB) - Black",0,0,"url 174","India",2019-10-29,"Awesome battery life, user interface is also good with an eye catching look.","4 stars","Apple","Mehul Verma","iPhoneWorth the money",4
"1739","Apple iPhone XR (64GB) - Black",0,0,"url 174","India",2019-10-31,"Battery life superb","5 stars","Apple","s. c.","Very good",5
"1740","Apple iPhone XR (64GB) - Black",0,0,"url 174","India",2019-09-10,"","5 stars","Apple","Prashant singh","👌🏻",5
"1741","Apple iPhone XR (64GB) - Black",0,0,"url 175","India",2019-08-04,"Best iphone","5 stars","Apple","sanibha","Best iphone",5
"1742","Apple iPhone XR (64GB) - Black",0,0,"url 175","India",2019-12-17,"just goo for it nothing is better then any another mombile at this price... the iphone xr gives you a ausome felling","5 stars","Apple","Hari","BEAST PHONE OF THE YEAR",5
"1743","Apple iPhone XR (64GB) - Black",0,0,"url 175","India",2019-11-05,"The best phone apple has ever produced","5 stars","Apple","shreeyash","Amazing phone",5
"1744","Apple iPhone XR (64GB) - Black",0,0,"url 175","India",2019-10-20,"If u talk about the review no need for reviews for iPhone just grab it","5 stars","Apple","Umamaheshwar","iPhone ever green product",5
"1745","Apple iPhone XR (64GB) - Black",0,0,"url 175","India",2019-11-09,"The best product Im using after iPhone 6s... Grate value for money... Need some improvement in connection quality...","5 stars","Apple","Srinadh Lolla","Nice product",5
"1746","Apple iPhone XR (64GB) - Black",1,0,"url 175","India",2020-02-13,"Best for gaming .","4 stars","Apple","Karan Warn","Ultimate gaming phone",4
"1747","Apple iPhone XR (64GB) - Black",0,0,"url 175","India",2020-03-05,"Just got in 45k. If u confused which is better to u just go for it this is excellent in this price segments","4 stars","Apple","PràJýot","⭐️⭐️⭐️⭐️⭐️",4
"1748","Apple iPhone XR (64GB) - Black",0,0,"url 175","India",2019-06-02,"Good","4 stars","Apple","KB","Good product",4
"1749","Apple iPhone XR (64GB) - Black",0,0,"url 175","India",2019-11-06,"Awesome mobile under 45k , Camera is just excellent in performance and also first time in Apple u will get long battery life","5 stars","Apple","Dheeraj Singh","@dheeraj singh",5
"1750","Apple iPhone XR (64GB) - Black",0,0,"url 175","India",2019-11-04,"Amazing performance with superb battery life, camera is outstanding.","5 stars","Apple","Digvijay Chavan","Amazing phone",5
"1751","Apple iPhone XR (64GB) - Black",0,0,"url 176","India",2019-08-21,"Nice phone","5 stars","Apple","Tanmay Gawankar","My dream phone thanks amazon",5
"1752","Apple iPhone XR (64GB) - Black",1,0,"url 176","India",2019-10-20,"It's too heavy compared to its previous models.","3 stars","Apple","pradhan","Heavy weight",3
"1753","Apple iPhone XR (64GB) - Black",0,0,"url 176","India",2019-10-02,"Its my ist  and best iphone that i had bought ever","5 stars","Apple","akki","Iphone Xr naam hi kaafi hai",5
"1754","Apple iPhone XR (64GB) - Black",0,0,"url 176","India",2019-11-17,"Say no to Apple don't give features after taking so much money","1 star","Apple","Neena","OVER PRICED",1
"1755","Apple iPhone XR (64GB) - Black",0,0,"url 176","India",2019-07-17,"Face ID and many features not found in android phones are excellent. One who gets used to will love every features...","5 stars","Apple","Mahendra Nath Murmu","New feature Face ID is excellent...",5
"1756","Apple iPhone XR (64GB) - Black",0,0,"url 176","India",2019-10-27,"Iphone XR is awesome but i took this cia amazon at 60k but after 3 days it shows 40k this so embarrassing.","3 stars","Apple","Nandini jadi","So embarrassing",3
"1757","Apple iPhone XR (64GB) - Black",0,0,"url 176","India",2019-10-10,"Nice...like it","4 stars","Apple","sandeep","Nice..",4
"1758","Apple iPhone XR (64GB) - Black",0,0,"url 176","India",2019-09-09,"Good","5 stars","Apple","S Chandra Reddy","My favourite phone",5
"1759","Apple iPhone XR (64GB) - Black",0,0,"url 176","India",2020-02-29,"Excellent performance","5 stars","Apple","Sreejith K R","5 star",5
"1760","Apple iPhone XR (64GB) - Black",0,0,"url 176","India",2019-08-24,"Even though LCD DISPLAY, It can bit others very easily","5 stars","Apple","Amit","Everything is good and worth every penny",5
"1761","Apple iPhone XR (64GB) - Black",0,0,"url 177","India",2019-07-17,"It has LCD display , brightness setting has to be maximum to view in sunlight","5 stars","Apple","Bharat","Great deal during offer",5
"1762","Apple iPhone XR (64GB) - Black",0,0,"url 177","India",2019-08-22,"Excellent I purchased on amazon prime day July 15th 2019 only 49999 .00 rupees","5 stars","Apple","Shekar","Super",5
"1763","Apple iPhone XR (64GB) - Black",0,0,"url 177","India",2019-12-01,"I phone mobile ...no comparison...Best gift for my husband ...nice packing","5 stars","Apple","Subhasmita Mallick","Awesome",5
"1764","Apple iPhone XR (64GB) - Black",1,0,"url 177","India",2019-10-20,"Good one","5 stars","Apple","Amazon Customer","Nice phone",5
"1765","Apple iPhone XR (64GB) - Black",1,0,"url 177","India",2019-10-21,"Its worthy...M not at all disappointed","4 stars","Apple","samreen","Buy it.you vl njoy",4
"1766","Apple iPhone XR (64GB) - Black",1,0,"url 177","India",2019-10-23,"This is my dream mobile","5 stars","Apple","Amazon Customer","Nice product",5
"1767","Apple iPhone XR (64GB) - Black",0,0,"url 177","India",2019-11-03,"Batter life is good comparatively with other IPhones.","4 stars","Apple","MOHAMMAD SHABEER","Budget phone",4
"1768","Apple iPhone XR (64GB) - Black",0,0,"url 177","India",2019-11-09,"Superb phone","5 stars","Apple","samara simhareddy","Superb phone",5
"1769","Apple iPhone XR (64GB) - Black",1,0,"url 177","India",2019-12-24,"Super But missing my iPhone XR Red 64gb","4 stars","Apple","muruganSricable","9443131911",4
"1770","Apple iPhone XR (64GB) - Black",1,0,"url 177","India",2019-10-20,"Love this phone","5 stars","Apple","Karthick","Performance",5
"1771","Apple iPhone XR (64GB) - Black",0,0,"url 178","India",2019-09-04,"No fingerprint , it uses face id. No dual camera but better potrait mode than one plus 7pro. Battery life is intermediate.","4 stars","Apple","Haritha K M","Above average phone.",4
"1772","Apple iPhone XR (64GB) - Black",0,0,"url 178","India",2019-11-19,"The speaker has strange sound, I shall request for the full refund,have lost my faith from Amazon.Please connect urgently.","1 star","Apple","Smriti","Extremely dissappointed",1
"1773","Apple iPhone XR (64GB) - Black",1,0,"url 178","India",2019-01-25,"Good","5 stars","Apple","An User","Good",5
"1774","Apple iPhone XR (64GB) - Black",0,0,"url 178","India",2019-11-03,"Awesome with good camera and a strong battery long last for a day!","5 stars","Apple","Kishore Mathiyarasu","Superb Battery !",5
"1775","Apple iPhone XR (64GB) - Black",1,0,"url 178","India",2019-09-26,"Very nice phone","5 stars","Apple","Amazon Customer","Good",5
"1776","Apple iPhone XR (64GB) - Black",0,0,"url 178","India",2019-11-16,"Awesome mobile with Good battery life and speed face recognition. As speed as what I thought of before purchase..","5 stars","Apple","Areef Ali","More than Expected",5
"1777","Apple iPhone XR (64GB) - Black",0,0,"url 178","India",2020-03-02,"The most amazing thing about XR is its battery life.","5 stars","Apple","Sandeep Singh","Value for money.",5
"1778","Apple iPhone XR (64GB) - Black",0,0,"url 178","India",2019-10-22,"Good","5 stars","Apple","Tetey","Excellent",5
"1779","Apple iPhone XR (64GB) - Black",0,0,"url 178","India",2019-07-12,"The seller was rude and in a hurry , still new to this phone. Its works just fine just feels weird without the touch sensor","3 stars","Apple","Amazon Customer","Awesome! I guess",3
"1780","Apple iPhone XR (64GB) - Black",0,0,"url 178","India",2019-10-15,"Good","4 stars","Apple","Naresh","Good",4
"1781","Apple iPhone XR (64GB) - Black",0,0,"url 179","India",2020-03-05,"Nice iphone","5 stars","Apple","Arshdeep singh","Good",5
"1782","Apple iPhone XR (64GB) - Black",0,0,"url 179","India",2019-07-12,"The screen got damaged but it was not observed by us initially. By the time we have seen , we are unable to cancel or replace the product","3 stars","Apple","Praneeth","Damaged screen",3
"1783","Apple iPhone XR (64GB) - Black",1,0,"url 179","India",2019-08-25,"All are working good","5 stars","Apple","Victor Francis","Good",5
"1784","Apple iPhone XR (64GB) - Black",0,0,"url 179","India",2019-08-08,"Every feature is good.sixe of screen is large.battery life is more than 24 hrs.Very much satified with I phone XR.Value for price.","5 stars","Apple","Gurmukh S.","I phone XR great purchase",5
"1785","Apple iPhone XR (64GB) - Black",0,0,"url 179","India",2019-10-18,"Good","5 stars","Apple","Amazon Customer","Good",5
"1786","Apple iPhone XR (64GB) - Black",0,0,"url 179","India",2019-10-02,"I received a defective iPhone. The quality standards were not maintained & its a shame that it has happened to an iPhone.","1 star","Apple","shubham awaghade","Quality defect",1
"1787","Apple iPhone XR (64GB) - Black",0,0,"url 179","India",2019-11-09,"I have bought iPhone XR on 3 october on amazon and my headset are not working where should I consult for its replacement","5 stars","Apple","karthik","Replacement of accessories",5
"1788","Apple iPhone XR (64GB) - Black",0,0,"url 179","India",2019-10-05,"Amazing product","5 stars","Apple","Manoj","Amazing",5
"1789","Apple iPhone XR (64GB) - Black",1,0,"url 179","India",2019-11-17,"Nice phone, but not the value for money","4 stars","Apple","Rakesh K V","Nice phone",4
"1790","Apple iPhone XR (64GB) - Black",0,0,"url 179","India",2019-11-07,"Perfect","4 stars","Apple","Siddhartha R.","Always good",4
"1791","Apple iPhone XR (64GB) - Black",1,1,"url 180","India",2019-11-13,"Duplicate charger have been imposed upon me.","1 star","Apple","Himanshu Banwal","Duplicate product",1
"1792","Apple iPhone XR (64GB) - Black",0,0,"url 180","India",2019-08-21,"Very good phone","5 stars","Apple","upendra","Excellent",5
"1793","Apple iPhone XR (64GB) - Black",0,0,"url 180","India",2019-08-03,"It has good graphics and camera quality.","5 stars","Apple","pawan","Better graphics and camera quality",5
"1794","Apple iPhone XR (64GB) - Black",0,0,"url 180","India",2019-11-02,"Nice phone. Good battery life, user friendly interface. Minus point is that it does not have fingerprint sensor.","4 stars","Apple","Mayur Bansal","Nice",4
"1795","Apple iPhone XR (64GB) - Black",0,0,"url 180","India",2019-10-02,"Great product ... Got it on amazon indian festival season","5 stars","Apple","Nikhilpm","Amazing phone for 40K",5
"1796","Apple iPhone XR (64GB) - Black",0,0,"url 180","India",2019-08-17,"Good product","5 stars","Apple","Mahipal Rautela","Good product",5
"1797","Apple iPhone XR (64GB) - Black",0,0,"url 180","India",2019-12-04,"Excellent iPhone model!","5 stars","Apple","Amazon Customer","Excellent iPhone Mobile",5
"1798","Apple iPhone XR (64GB) - Black",0,0,"url 180","India",2019-11-09,"Good battery life","5 stars","Apple","raghav","Battery beast",5
"1799","Apple iPhone XR (64GB) - Black",0,0,"url 180","India",2019-09-20,"Iphone is Iphone, have used android before but like over all look and feel of iOS is way better.","5 stars","Apple","Jinen","Value for Money",5
"1800","Apple iPhone XR (64GB) - Black",0,0,"url 180","India",2019-10-06,"Excellent performance, fantastic phone.","5 stars","Apple","USP","Excellent product",5
"1801","Apple iPhone XR (64GB) - Black",0,0,"url 181","India",2020-03-01,"Best phone","5 stars","Apple","ASHIS KUMAR","Best phone",5
"1802","Apple iPhone XR (64GB) - Black",0,0,"url 181","India",2019-10-04,"The phone is decent.If you get it for 40k then it makes sense but any more than that its not worth much","5 stars","Apple","Amazon Customer","Around 40k perfect price",5
"1803","Apple iPhone XR (64GB) - Black",0,0,"url 181","India",2019-11-06,"Got it for 38k in sale..good work by amazon..genuine product with fast delivery","5 stars","Apple","Abhiney","Good deal to buy from amazon",5
"1804","Apple iPhone XR (64GB) - Black",1,0,"url 181","India",2019-10-21,"Best buy ever","5 stars","Apple","Amazon Customer","Love iphone",5
"1805","Apple iPhone XR (64GB) - Black",0,0,"url 181","India",2019-10-26,"The battery life is not so good.","4 stars","Apple","vijay desai","Battery life",4
"1806","Apple iPhone XR (64GB) - Black",0,0,"url 181","India",2019-07-23,"Good value for money. Expensive but worth it. Was earlier using iPhone 6 and this is a great upgrade.","5 stars","Apple","onkar singh","Good value for money",5
"1807","Apple iPhone XR (64GB) - Black",0,0,"url 181","India",2019-11-24,"Nice phone from apple big screen good battery and on top of that dual sim","4 stars","Apple","Viren Kavil","An apple keeps others away",4
"1808","Apple iPhone XR (64GB) - Black",0,0,"url 181","India",2019-10-13,"Like","5 stars","Apple","Asit ku samantasinghar","Wwwoooww",5
"1809","Apple iPhone XR (64GB) - Black",0,0,"url 181","India",2020-02-29,"Nice Phone... White colour is sophisticated and looks premium...","4 stars","Apple","Pankajkumar Jagtap","White colour is awesome",4
"1810","Apple iPhone XR (64GB) - Black",0,0,"url 181","India",2019-10-09,"Amazing product camera is good ,I cant  use the fingerprint reader.","5 stars","Apple","Md.Jahangir","Amazing",5
"1811","Apple iPhone XR (64GB) - Black",0,0,"url 182","India",2019-10-02,"Value for money, highly recommended @this price range.","5 stars","Apple","Viraat Mathur","BEST PURCHASE @38k",5
"1812","Apple iPhone XR (64GB) - Black",0,0,"url 182","India",2019-10-15,"Battery life is amazing phone is pretty awesome","4 stars","Apple","Shashank kumar","Loved it",4
"1813","Apple iPhone XR (64GB) - Black",0,0,"url 182","India",2019-10-26,"Got it at Rs 40k","5 stars","Apple","Anil kumar chowdary","Good Mobile",5
"1814","Apple iPhone XR (64GB) - Black",0,0,"url 182","India",2020-03-02,"Its a gud phone but a lill bulky!! Battery life is awesome !! Phone is working well!!","3 stars","Apple","Brij","Gud one",3
"1815","Apple iPhone XR (64GB) - Black",1,0,"url 182","India",2020-02-11,"Thats amazing iphone in this price .","5 stars","Apple","naman singh","Battery life ,quality ,performance every thing is good",5
"1816","Apple iPhone XR (64GB) - Black",0,0,"url 182","India",2019-10-03,"The phone is awesome i am quite happy with Amazon.","5 stars","Apple","ashish alvin patrick","Really happy with it.",5
"1817","Apple iPhone XR (64GB) - Black",0,0,"url 182","India",2019-12-05,"Battery life is good , camera is not that good at this price point , games run smooth but gets heated.","3 stars","Apple","Amazon Customer","It’s ok",3
"1818","Apple iPhone XR (64GB) - Black",1,0,"url 182","India",2019-10-18,"Product was awesome and now itself feeling the enthusiasm of xr","4 stars","Apple","Abraar khan","Best iPhone for the price",4
"1819","Apple iPhone XR (64GB) - Black",0,0,"url 182","India",2019-10-06,"apple Phones need not strive on reviews. They are just amazing small machines!","5 stars","Apple","USD","Amazing phone!",5
"1820","Apple iPhone XR (64GB) - Black",0,0,"url 182","India",2019-08-24,"Good response time for Face unlock, excellent camera and a decent battery life","5 stars","Apple","mahesh","Overall very good",5
"1821","Apple iPhone XR (64GB) - Black",0,0,"url 183","India",2019-12-21,"There is nothing to dislike because i got the same thing that company made ...","5 stars","Apple","sunny","Good",5
"1822","Apple iPhone XR (64GB) - Black",0,0,"url 183","India",2020-03-09,"Excellent","5 stars","Apple","kota","I phone XR",5
"1823","Apple iPhone XR (64GB) - Black",0,0,"url 183","India",2019-12-02,"Awesome camera.The only weak point I got upset is the weight of the phone.Apart from that everything looks mesmerising.","5 stars","Apple","Melvi","iPhone XR",5
"1824","Apple iPhone XR (64GB) - Black",1,0,"url 183","India",2019-10-14,"Its awesome","5 stars","Apple","Amazon Customer","Very good at 41k",5
"1825","Apple iPhone XR (64GB) - Black",1,0,"url 183","India",2020-02-05,"Voice is not coming need to exchange","1 star","Apple","muzammil","Not working",1
"1826","Apple iPhone XR (64GB) - Black",0,0,"url 183","India",2019-07-20,"It has Face ID that works well. Awesome product !","5 stars","Apple","Hawks","10/10",5
"1827","Apple iPhone XR (64GB) - Black",0,0,"url 183","India",2019-10-30,"Hi phone is good but USB cable didnt work from the start, kindly sent a new USB cable bcoz i cant use my phone.","4 stars","Apple","Abhijit Bugde","USB cable not working",4
"1828","Apple iPhone XR (64GB) - Black",0,0,"url 183","India",2020-03-03,"Amazed by speed and camera quality! Apple never disappoints me!","5 stars","Apple","Amazon Customer","Just loving it!!!",5
"1829","Apple iPhone XR (64GB) - Black",0,0,"url 183","India",2020-01-04,"Apple is always best in their segments","5 stars","Apple","Devashish Das","Classs",5
"1830","Apple iPhone XR (64GB) - Black",0,0,"url 183","India",2019-10-16,"As always the best product from Apple is the best","5 stars","Apple","pooja","Amazing",5
"1831","Apple iPhone XR (64GB) - Black",0,0,"url 184","India",2020-01-13,"The best and the only iPhone which broke iPhone 6s record, this is worth 43k without a doubt","5 stars","Apple","Vijay","The best iPhone with the best colour",5
"1832","Apple iPhone XR (64GB) - Black",1,0,"url 184","India",2019-07-14,"What to say...just wow!!!","5 stars","Apple","Amazon Customer","Beast XR",5
"1833","Apple iPhone XR (64GB) - Black",0,0,"url 184","India",2020-01-03,"Excellent Phone.","5 stars","Apple","Amazon Customer","Excellent Phone",5
"1834","Apple iPhone XR (64GB) - Black",0,0,"url 184","India",2019-10-07,"Amazing phone.","5 stars","Apple","jaydeep","Value for money",5
"1835","Apple iPhone XR (64GB) - Black",0,0,"url 184","India",2019-11-12,"This mobile is completely worrest, signal issues iam using airtel sim signal receiving problem please solve my problem","1 star","Apple","Amazon Customer","Mobile is not good",1
"1836","Apple iPhone XR (64GB) - Black",0,1,"url 184","India",2019-12-23,"A disappointment.Never purchase iPhone from here.They are defective.In my case one speaker is not working.Such a shame","1 star","Apple","Sudeep Sarkar","defective iphone",1
"1837","Apple iPhone XR (64GB) - Black",0,0,"url 184","India",2020-02-02,"Simply the beast at least.","5 stars","Apple","Ramesh","I’m loving it",5
"1838","Apple iPhone XR (64GB) - Black",1,0,"url 184","India",2020-03-10,"Good","5 stars","Apple","Mallayya","Excellent",5
"1839","Apple iPhone XR (64GB) - Black",1,0,"url 184","India",2020-02-24,"Battery back is not as told","5 stars","Apple","shifa khan","No battery back up",5
"1840","Apple iPhone XR (64GB) - Black",0,0,"url 184","India",2019-11-02,"Amazing experience only limitation little bit heavy and thick. Face ID very fast. Good sound quality.","5 stars","Apple","shashank","I phone xr",5
"1841","Apple iPhone XR (64GB) - Black",0,0,"url 185","India",2019-10-27,"Worth buying","5 stars","Apple","Dinesh B Chavan","Excellent choice",5
"1842","Apple iPhone XR (64GB) - Black",0,0,"url 185","India",2019-11-04,"Very smooth and comfortable","5 stars","Apple","Shravani","Classy product from apple",5
"1843","Apple iPhone XR (64GB) - Black",0,0,"url 185","India",2019-06-15,"Good look.i have to see its performance,at present i am annoyed with its ringtone.also file transfer though shareit app does not work","4 stars","Apple","Vijai Kumar Ranjan","Ringtone is very very low even if adjustments made as per iphone guide.",4
"1844","Apple iPhone XR (64GB) - Black",0,0,"url 185","India",2019-10-05,"Great purchase.Thank you amazon","5 stars","Apple","sridhar","Got more for less",5
"1845","Apple iPhone XR (64GB) - Black",0,0,"url 185","India",2019-12-01,"Good","5 stars","Apple","krishna","Good",5
"1846","Apple iPhone XR (64GB) - Black",0,0,"url 185","India",2019-11-03,"iphone have short battery life as compared to android .","5 stars","Apple","bhavishya deep","good",5
"1847","Apple iPhone XR (64GB) - Black",0,0,"url 185","India",2019-11-04,"Good phone with excellent battery life. Pictures taken are crisp and clear. Runs very very smooth on IOS 13.2","4 stars","Apple","arjun","iPhones know for smoothness",4
"1848","Apple iPhone XR (64GB) - Black",0,0,"url 185","India",2020-03-04,"It's very good iPhone I use till today....","5 stars","Apple","Debadutta Mohanty","Very good product",5
"1849","Apple iPhone XR (64GB) - Black",0,0,"url 185","India",2019-05-21,"Amazing choice","5 stars","Apple","Sumit","Genuine product",5
"1850","Apple iPhone XR (64GB) - Black",0,0,"url 185","India",2020-02-18,"Very good product can be told as a beast in this price range and has excellent graphics for gaming .","5 stars","Apple","Amazon Customer","XR the beast !",5
"1851","Apple iPhone XR (64GB) - Black",0,0,"url 186","India",2019-09-04,"Battery life not good and it dont detects face at times to unlock and I received faulty charger which is not working","3 stars","Apple","Amazon Customer","Not worth at all against this price",3
"1852","Apple iPhone XR (64GB) - Black",0,0,"url 186","India",2019-12-07,"It's just one month and the phone not switch ing on....","1 star","Apple","Aniruddha","Bad",1
