"","product","helpful_count","total_comments","url","review_country","reviewed_at","review_text","review_rating","product_company","profile_name","review_title","review"
"658","Apple iPhone XR (64GB) - Black",0,0,"url 66","India",2019-09-30,"First time apple user... but to be honest... apple is amazing from the all aspects.. camera, sound , battery , display , lagging issues everything is far better than android mobile....its 12 mp camera looks like 48 mp of an android mbl...! Quality differs from others !!!!","5 stars","Apple","RK Nayek","Awesome purchase",5
"659","Apple iPhone XR (64GB) - Black",0,0,"url 66","India",2019-10-17,"Iphone is the best. Prompt delivery from Amazon. Two camera could have been even better","5 stars","Apple","Sugandhan","Good One",5
"660","Apple iPhone XR (64GB) - Black",1,0,"url 66","India",2019-10-20,"Good product, great experience!","5 stars","Apple","Amazon Customer","Amazing product!",5
"661","Apple iPhone XR (64GB) - Black",0,0,"url 67","India",2019-10-08,"When I switched on it started getting heated up near camera.  Mix of gold and yellow is bit ugly. My other side of speaker isnt working. Selfie portrait is good rest is not much appreciable.","2 stars","Apple","Amazon Customer","Not worth it",2
"662","Apple iPhone XR (64GB) - Black",0,0,"url 67","India",2019-08-13,"Superb it is. It does not require any review. Large screen, superb quality, 128 GB memory and what else you want","5 stars","Apple","DEEPAK SHENOY","Loved it 😀",5
"663","Apple iPhone XR (64GB) - Black",0,0,"url 67","India",2019-11-29,"iPhone XR is the current rightly priced phone from Apple. It is a good product . This phone does not have fingerprint unlock security, only face recognition is present.","4 stars","Apple","Ananymous","At present the rightly priced iPhone",4
"664","Apple iPhone XR (64GB) - Black",0,0,"url 67","India",2019-07-28,"Perfect phone for Apple lovers, camera and built quality of this phone is amazing. Its around 6 months when I purchased this phone, everything works like a charm, there are lot of hidden features that I still dont know about this phone.","5 stars","Apple","Amazon Customer","Excellent investment!",5
"665","Apple iPhone XR (64GB) - Black",0,0,"url 67","India",2019-08-21,"Reason for 4 star as the earphone given as part of this purchase are not up to the mark and when I take call using earphone people complaint about sound is not proper and sound come good when I remove the earphone while talking on phone.","4 stars","Apple","Abhishek K.","Good phone but bad earphone quality.",4
"666","Apple iPhone XR (64GB) - Black",0,0,"url 67","India",2019-10-15,"I had bad experience from Amazon within 2 days my phone having charging issue and I didn't get any response from Amazon.","1 star","Apple","SUMIT RAJPUT","Don't bye iPhone from Amazon",1
"667","Apple iPhone XR (64GB) - Black",0,0,"url 67","India",2020-01-25,"I have upgraded from iPhone 7. Face recognition excellent, Camera Good with portrait photography. Battery life... Very good. Bit heavier, but comfortable!","5 stars","Apple","John Christopher","iPhone XR",5
"668","Apple iPhone XR (64GB) - Black",0,0,"url 67","India",2020-03-20,"Amazon did the delivery a little bit late. But the phone is awsome.","5 stars","Apple","PRAVEEN","Apple as Apple.",5
"669","Apple iPhone XR (64GB) - Black",0,0,"url 67","India",2019-12-14,"Very nice phone, very fluid interface, face recognition is really very good but I think Apple should bring back the fingerprint scanner and that Apple specific home button.","5 stars","Apple","Praveen Kumar Mishra","Amazing, worth buying.",5
"670","Apple iPhone XR (64GB) - Black",0,0,"url 67","India",2019-10-15,"I got this during festival sale at Rs 45000 and I am really enjoying this phone. Performance, camera, sound, display everything is top standard and no smartphone can match this at this price. Love this ","5 stars","Apple","Rohit kurmi","iPhone only name is enough",5
"671","Apple iPhone XR (64GB) - Black",0,0,"url 68","India",2019-10-15,"Phone is not working properly and they are not replacing my product and the product was in replacement warranty.  Please do not buy from Amazon because if there will be any problem under 10 days they will not replace the phone. They will just give the customer care no.","1 star","Apple","Mohit Bansiwal","Speakers And Hang",1
"672","Apple iPhone XR (64GB) - Black",0,0,"url 68","India",2019-11-25,"Lot of software issues in it. Specially your contact names will not displayed on screen when you receive the call from one of your stored contact person. Raised the issue multiple times but very poor performance from Apple. Don't buy this model.","1 star","Apple","Amazon Customer","Don't buy this phone, invest in other phones",1
"673","Apple iPhone XR (64GB) - Black",0,0,"url 68","India",2019-08-19,"People spoke have criticised about the iPhone XR's screen, compared to xs I found this screen is more colour accurate,","5 stars","Apple","Amazon Customer","Beautiful (Product)red",5
"674","Apple iPhone XR (64GB) - Black",0,0,"url 68","India",2020-03-11,"My new XR PHONE  is GETTING HUNG frequently When I shuffle around the apps. I dont have much apps active though I moved apps from my iCloud. Even few apps get struck and couldnot do any actions. I havent seen in my 6S though the issue.","1 star","Apple","Srikanth Sankaran","Not really at its best",1
"675","Apple iPhone XR (64GB) - Black",0,0,"url 68","India",2019-11-08,"Using it since 15 days and till now could not find anything disappointing with this phone. Battery running for about 2 days!, Camera is single lens but clicks very good, Speed and screen all is perfect. Upgraded myself from Iphone 6s.","5 stars","Apple","Pranshu","Great phone to buy",5
"676","Apple iPhone XR (64GB) - Black",0,0,"url 68","India",2020-01-07,"Awesome experience with IPhone XR red Color","5 stars","Apple","Deepak Pv","Amazing n awesome",5
"677","Apple iPhone XR (64GB) - Black",1,0,"url 68","India",2020-01-18,"There are some problems with the iPhone xr I bought 15 days ago.","1 star","Apple","Srishti raj","iPhone xr",1
"678","Apple iPhone XR (64GB) - Black",0,0,"url 68","India",2019-12-04,"Most affordable iphone really proves when it comes to photography, performance and off-course Battery backup. Having been with it for almost 2 months it has clicked most of the boxes urban smartphone should offer.","5 stars","Apple","Sunny S.","XR justifies its existence",5
"679","Apple iPhone XR (64GB) - Black",0,0,"url 68","India",2019-08-31,"Only complaint that face reader is not as great as fingerprint reader in older version of iphone.","5 stars","Apple","Gaurav J.","Only complaint that face reader is not as great as fingerprint reader in older version of iphone.",5
"680","Apple iPhone XR (64GB) - Black",0,0,"url 68","India",2019-10-29,"iPhone XR simple superb.","5 stars","Apple","Bvv Suresh","Delivered before promised date",5
"681","Apple iPhone XR (64GB) - Black",0,0,"url 69","India",2020-03-04,"Awesome phone, good battery life, awesome camera... 4k recording and i have started vlogging channel in YouTube with xr only,,, shooting, editing and uploading all in one.. awesome performance.","5 stars","Apple","Vatsal Pandya","Just amazing!!",5
"682","Apple iPhone XR (64GB) - Black",0,0,"url 69","India",2019-11-01,"What I really admire about this piece is 2 things:","4 stars","Apple","Ashish G.","Good experience",4
"683","Apple iPhone XR (64GB) - Black",0,0,"url 69","India",2019-10-03,"The product I received is value for money. Battery life is pretty much cool. Loved the system performance. Worth buying.","5 stars","Apple","Amitansu","Iphone 😘",5
"684","Apple iPhone XR (64GB) - Black",1,0,"url 69","India",2020-04-10,"I ordered the phone on August 8 2019 and it was delivered to me on August 14 2019 and its been 7 months and now my phone is fully dead and is not working at all.","1 star","Apple","Rafeeque Kaniyattil","I phone",1
"685","Apple iPhone XR (64GB) - Black",0,0,"url 69","India",2019-10-02,"I have only used the phone for couple of days now, but it looks really good. Amazon did a good job in timely delivery. Probably the phone is very good so far, and I am in no position to give a proper feedback unless have used it for a while.","5 stars","Apple","Amazon Customer","So far the best thing Amazon delivered",5
"686","Apple iPhone XR (64GB) - Black",0,0,"url 69","India",2019-11-05,"Best if u dont want to see annoying ads in ur feed","5 stars","Apple","Shiv","Simple usage",5
"687","Apple iPhone XR (64GB) - Black",0,0,"url 69","India",2019-10-27,"Great product, a good upgrade from iPhone 6s, large screen, fast, water resistant, great camera, and looks good too","5 stars","Apple","Amazon Customer","Good buy",5
"688","Apple iPhone XR (64GB) - Black",1,0,"url 69","India",2019-11-18,"Original Product , still remember while opening the packet please make a short video of what you received.","5 stars","Apple","Paras grover","Original Product ☺️",5
"689","Apple iPhone XR (64GB) - Black",0,0,"url 69","India",2019-10-15,"Superb phone. Wish they could match the battery life with what other manufacturers are offering at one third the price","4 stars","Apple","Sb","Good phone, battery could have been better",4
"690","Apple iPhone XR (64GB) - Black",0,0,"url 69","India",2019-10-11,"Apple may release the dual sim slots for India. It may increase the sale and customer also i think.","3 stars","Apple","G Ramaesh Babu","nice one",3
"691","Apple iPhone XR (64GB) - Black",1,0,"url 70","India",2019-10-01,"Defective piece","1 star","Apple","Ankit Shah","Defective piece, poor mobile Network.",1
"692","Apple iPhone XR (64GB) - Black",0,0,"url 70","India",2019-10-29,"This is awesome product as usual. Didnt regret but buy this. Must go for it. Only thing, this is a bit bigger phone for single hand user.","5 stars","Apple","Gurvinder Singh","Awesome",5
"693","Apple iPhone XR (64GB) - Black",0,0,"url 70","India",2019-08-23,"Great phone with good fingerprint reader, camera quality and long lasting battery life !","5 stars","Apple","Amazon Customer","Apple XR (64 GB) mobile phone",5
"694","Apple iPhone XR (64GB) - Black",1,0,"url 70","India",2020-02-26,"As always grt","5 stars","Apple","atul","Nice",5
"695","Apple iPhone XR (64GB) - Black",0,0,"url 70","India",2019-10-27,"Nice product, looks good","4 stars","Apple","Vishal","good product",4
"696","Apple iPhone XR (64GB) - Black",2,0,"url 70","India",2019-06-09,"Awesome mobile..","5 stars","Apple","G. Ajaz Ahmed","Nice",5
"697","Apple iPhone XR (64GB) - Black",1,0,"url 70","India",2019-10-10,"Very bad experience with the iPhone XR","1 star","Apple","Kaihr","Not turning on",1
"698","Apple iPhone XR (64GB) - Black",0,0,"url 70","India",2019-10-06,"Battery life is good but the problem is with the phone heating very quickly. Even redmi's who are known for getting heated quickly, get less heated as compared to iPhone Xr. I steal one star for it.","4 stars","Apple","Kanak","Phone gets heated quickly.",4
"699","Apple iPhone XR (64GB) - Black",0,0,"url 70","India",2020-03-01,"iPhone XR is really one of the best Apple Products Ive ever used! Ive had used iPhones in the past but nothing matches XRs feel and optimisation. Not only does it look good, but also performs superbly well. Much recommended.","5 stars","Apple","Pratik Banerjee","An Apple a day, keeps negative vibes away.",5
"700","Apple iPhone XR (64GB) - Black",0,0,"url 70","India",2019-08-20,"The features of the phone are very good. Camera and the operating system.","4 stars","Apple","Amazon Customer","Good performance phone with a not so good battery life.",4
"701","Apple iPhone XR (64GB) - Black",0,0,"url 71","India",2019-09-05,"Anyone here to compare this with android. Please keep in my, comparison happens between apple to apple and not apple with oranges.","5 stars","Apple","Rahul","Dont compare with android",5
"702","Apple iPhone XR (64GB) - Black",0,0,"url 71","India",2019-10-17,"1. I have purchased iPhone XR 64 GB .All are features seems good as per expectation but I got newt work issue in this phone .","3 stars","Apple","vishal","eSim network issue major ISSUE",3
"703","Apple iPhone XR (64GB) - Black",0,0,"url 71","India",2019-10-09,"Hanging issue, network dropping issue needed restart to get network again. Face detection is also very disappointed, please never waste your money with this product.","1 star","Apple","dalvendra k.","Waste of money.",1
"704","Apple iPhone XR (64GB) - Black",1,0,"url 71","India",2019-03-27,"Nice phone in all respect.","5 stars","Apple","LAXMAN KALUBARME","Nice phone",5
"705","Apple iPhone XR (64GB) - Black",0,0,"url 71","India",2020-03-05,"Just go for it, try buying the 128GB or 256GB model if you are planning to record your game clips ... because 30mins of screen recording costs 4GB memory ....","5 stars","Apple","Akash Barman","Best for PUBG",5
"706","Apple iPhone XR (64GB) - Black",1,0,"url 71","India",2019-11-26,"Best phone for the best price. Purchased at prime sale for 40k. Best iPhone ever for this budget.","5 stars","Apple","Shirun Kumar","Superb performance",5
"707","Apple iPhone XR (64GB) - Black",0,0,"url 71","India",2019-11-22,"Worth the money, performance is good even with 3gb memory.  Apps are pretty fast.","5 stars","Apple","Pradeep Gattupalli","I enjoy using the phone",5
"708","Apple iPhone XR (64GB) - Black",0,0,"url 71","India",2020-01-06,"Its a good phone obviously, It doesnt have any defects, delivery was smooth and non-problematic, phone works great, best camera ever, overall, Im happy with my purchase","5 stars","Apple","Dibyoshree S.","Pretty good",5
"709","Apple iPhone XR (64GB) - Black",2,0,"url 71","India",2019-10-06,"The Iphone has been stuck on set up page after i tried restoring it.","1 star","Apple","Preeti Sanghvi","Defective",1
"710","Apple iPhone XR (64GB) - Black",0,0,"url 71","India",2019-11-06,"I heard many people fear to use Apple phones as its os is slightly difficult to use. But I feel that once we are familiar with it then it is very easy to use compared with android phones. The build quality is superb. Also the camera is fantastic.","5 stars","Apple","JAYAPRASAD","Very good",5
"711","Apple iPhone XR (64GB) - Black",0,0,"url 72","India",2019-11-20,"Good phone. I been an iphone user for the design simplicity. This is a good phone. One does not need a pro version. This is a champ","4 stars","Apple","Rishi Srivatsa","Very nice",4
"712","Apple iPhone XR (64GB) - Black",0,0,"url 72","India",2019-06-19,"Have bought this iPhone after iPhones 6.im pretty happy with the device,battery is too good,camera is great,Performance is swift no lags till now played hefty games like pubg  and asphalt 8 on this phone no lags were found at all.overall an excellent device","5 stars","Apple","Lovepreet Singh","Awesome iPhone yet",5
"713","Apple iPhone XR (64GB) - Black",1,0,"url 72","India",2019-10-18,"I bought this phone last week and in one week charger started misbehaving. Sometimes charger got disconnected and sometimes phone is not getting charged .","1 star","Apple","Priyanka Vats","Charger is pathetic",1
"714","Apple iPhone XR (64GB) - Black",0,0,"url 72","India",2019-10-17,"I purchased it from Appario pvt ltd. And they sent me a genuine, brand new iPhone XR so 5 stars.","5 stars","Apple","Just Kidding","5 stars for Amazon",5
"715","Apple iPhone XR (64GB) - Black",0,0,"url 72","India",2019-10-25,"Best budget phone by apple,cant believe the overall performance and the tremendous display quality, who says the display is not good, obviously its not good its excellent. And thanks to Amazon for providing me the phone within 12hrs.","5 stars","Apple","Amazon Customer","Best budget I phone",5
"716","Apple iPhone XR (64GB) - Black",0,0,"url 72","India",2020-03-22,"I already have Google Pixel 2XL. I can proudly say that iphone XR can not match the camera quality of Pixel.","5 stars","Apple","BK Sumit","Android over iOS",5
"717","Apple iPhone XR (64GB) - Black",1,0,"url 72","India",2019-10-12,"good so far it s been a week battery is good .... not fond of clicking pics so cant say but clicked few theay are good","5 stars","Apple","mandeep","good so far..",5
"718","Apple iPhone XR (64GB) - Black",1,0,"url 72","India",2019-10-16,"Great device. Battery easily last for a day. Amazing Camera. Got it for 40k and at this price there can't be any better device.","5 stars","Apple","Abhijeet Singh","Great Device, surely go for it.",5
"719","Apple iPhone XR (64GB) - Black",0,0,"url 72","India",2019-10-02,"I upgraded from iPhone 5s to iPhone XR and Im not regretting at all. Battery capacity, camera, speed, everything seems perfect for me. Your budget is not enough to buy iPhone 11, max or max pro then definitely you can go for this. You will not regret it.","4 stars","Apple","Amazon Customer","Best iPhone model under budget",4
"720","Apple iPhone XR (64GB) - Black",0,0,"url 72","India",2019-12-04,"Really great product by apple just love the beast inside this machine... charging is quite good. And mostly pubg is super smooth and everything is great really a beast by apple","5 stars","Apple","Anirban pramanik","Simply beast..",5
"721","Apple iPhone XR (64GB) - Black",1,0,"url 73","India",2019-10-20,"One month of usage and the phone is dead ! Tried all solutions suggested by apple but no signs of recovery. Next option is to take it to service center.","1 star","Apple","ANASH SASHEE","XR - Unreliable model",1
"722","Apple iPhone XR (64GB) - Black",0,0,"url 73","India",2019-10-02,"iPhone XR one of the best mobile and os","5 stars","Apple","Manu Narayanswamy MP","😍😍",5
"723","Apple iPhone XR (64GB) - Black",1,0,"url 73","India",2019-10-20,"Finger print reading and camera quality is good. Apple is the best.","5 stars","Apple","Guru","iPhone is best",5
"724","Apple iPhone XR (64GB) - Black",0,0,"url 73","India",2019-11-05,"iPhone XR 64gb is best buy even in 2019. I bought it during festive sale at 37,999/-","5 stars","Apple","Sanchit Mair","XR is best buy in 2019",5
"725","Apple iPhone XR (64GB) - Black",0,0,"url 73","India",2019-10-05,"I am happy to buy this amazing phone from Amazons thanks .... its original phone ....love this camera .each and every thing in box charger headphones manuals books...seal box Recived.","5 stars","Apple","Aarav sah","Nice phone Recived original packing",5
"726","Apple iPhone XR (64GB) - Black",1,0,"url 73","India",2019-11-27,"Best in the Class...","5 stars","Apple","anup kumbhar","Great product",5
"727","Apple iPhone XR (64GB) - Black",0,0,"url 73","India",2019-11-04,"Awesome battery life, magnificent design, camera quality 10/10, fully satisfied, worth of every penny. Buy it with blind eyes.","5 stars","Apple","RB","As always best phone.",5
"728","Apple iPhone XR (64GB) - Black",1,0,"url 73","India",2020-01-23,"If you want a new phone, just go for the Xr because its price is pretty reasonable and also it has a very good battery life. I am very happy with it","5 stars","Apple","Pradeep","Amazing phone",5
"729","Apple iPhone XR (64GB) - Black",2,0,"url 73","India",2020-02-14,"Speaker not working one side when I get calls sound very lowwww","4 stars","Apple","Satish","Xr",4
"730","Apple iPhone XR (64GB) - Black",0,0,"url 73","India",2019-10-02,"Value for money phone . bought at 39999. perfect . absolutely perfect .","5 stars","Apple","kv","value for money phone that works . period .",5
"731","Apple iPhone XR (64GB) - Black",0,0,"url 74","India",2019-10-29,"Good one, very nice product, no complaints till date camera is good, super battery life loved the product, red colour is awesome","5 stars","Apple","Lavi","iPhone XR red",5
"732","Apple iPhone XR (64GB) - Black",0,0,"url 74","India",2019-09-19,"It's a genuine product, verified on apple's website. Everything is working as expected","5 stars","Apple","Amazon Customer","Good product",5
"733","Apple iPhone XR (64GB) - Black",0,0,"url 74","India",2020-01-29,"Everything was just perfect.","5 stars","Apple","Mayur","More than perfect 😊",5
"734","Apple iPhone XR (64GB) - Black",1,0,"url 74","India",2019-10-12,"Within a week the ringer volume varies and the  WiFi signal is very weak when compared to other iphones.","1 star","Apple","kashvi","Apple products quality  have deteriorated to maintain price competition.",1
"735","Apple iPhone XR (64GB) - Black",0,0,"url 74","India",2019-12-23,"Camara quality is good , Face ID works well.","1 star","Apple","sushil","Heat up Issue/ Battery drainage Issue",1
"736","Apple iPhone XR (64GB) - Black",1,0,"url 74","India",2019-03-03,"Everything good you expect of an iPhone","5 stars","Apple","ganesh.raman","Very good phone",5
"737","Apple iPhone XR (64GB) - Black",0,0,"url 74","India",2020-01-06,"Super phone ... great product and thanks to amazon for the great price","5 stars","Apple","Amazon Customer","Lovely phone , super camera",5
"738","Apple iPhone XR (64GB) - Black",0,0,"url 74","India",2019-11-03,"Man the battery life increment from iPhone 7 was mind blowing.. screen is not a problem unless u have used a 1080p oled screen.","5 stars","Apple","Amazon Customer","Wonderful phone",5
"739","Apple iPhone XR (64GB) - Black",2,0,"url 74","India",2019-07-20,"Perfect phone at perfect price. Most liked Apple phone with dual sim.","5 stars","Apple","Deepak","Perfect phone at perfect price",5
"740","Apple iPhone XR (64GB) - Black",0,0,"url 74","India",2019-10-03,"Amazon price of this phone is lowest. 43000 Rs.","5 stars","Apple","Kunal Kashyap","Best Mobile phone under this price. + Camera(5*) + Battery (5*)",5
"741","Apple iPhone XR (64GB) - Black",1,0,"url 75","India",2019-10-14,"Best phone with best display battery camera is excellent everything is best","5 stars","Apple","priyanshu u.","Best phone",5
"742","Apple iPhone XR (64GB) - Black",0,0,"url 75","India",2020-02-29,"Total fraud gone with me , initially face sacnner was good but now a days after one month its not working properly n problem of going phone hang is obvious n regular, total disappointed from this phone n if this happens further i m gonna sue them","1 star","Apple","parveen","Not good",1
"743","Apple iPhone XR (64GB) - Black",1,1,"url 75","India",2019-08-18,"@AmazonIndia It has almost been three months since I bought this phone and am now facing a problem with its left audio speaker which has completely stopped working. Only the right audio speaker is functioning.  Kindly assist.","1 star","Apple","Amazon Customer","Left audio speaker not working",1
"744","Apple iPhone XR (64GB) - Black",0,0,"url 75","India",2019-11-10,"A hair line crack which could only be detected by the shop keeper who was applying the screen guard . A very fine crack which was missed","1 star","Apple","Amazon Customer","Defective",1
"745","Apple iPhone XR (64GB) - Black",0,0,"url 75","India",2020-03-01,"Product arrived good,got it at Rs 38000 at amazon sale.Thanks Amazon","5 stars","Apple","Sunil Rigesow","Happy with the purchase",5
"746","Apple iPhone XR (64GB) - Black",1,0,"url 75","India",2019-07-29,"Good phone.  Not aware it has finger print reader","5 stars","Apple","Kutumbarao Kanuri","iPhone XR",5
"747","Apple iPhone XR (64GB) - Black",1,0,"url 75","India",2019-10-21,"Apple iPhone xR, I think this product dont need any recommendations, only my review for amazon sale. I bought this at never before price 37999/-","5 stars","Apple","Vipinvasudeva","Best deal.",5
"748","Apple iPhone XR (64GB) - Black",0,0,"url 75","India",2019-11-07,"Only cons are overall little bezel around the screen as compare to XS version. Battery lasts for a day on normal use including music, chatting and social media use.","4 stars","Apple","Tushar Sharma","Performs as expected. Fully satisfied.",4
"749","Apple iPhone XR (64GB) - Black",1,0,"url 75","India",2020-02-12,"Good delivery from amazon","5 stars","Apple","Arya","Go for it without any doubts",5
"750","Apple iPhone XR (64GB) - Black",0,0,"url 75","India",2019-11-09,"This is an awesome product by Apple.","5 stars","Apple","Samrat","Awesome design, low light photography is thumbs down.",5
"751","Apple iPhone XR (64GB) - Black",1,0,"url 76","India",2019-07-18,"Awesome product, Worth buying if in budget","5 stars","Apple","Amazon Customer","Awesome product...",5
"752","Apple iPhone XR (64GB) - Black",0,0,"url 76","India",2019-06-17,"One of the best iphone I have ever used.  battery life very good.Camera quality has no match when it comes to shooting videos from XR.","4 stars","Apple","Praveen","A perfect phone",4
"753","Apple iPhone XR (64GB) - Black",2,0,"url 76","India",2019-04-03,"Amazon service is good.","4 stars","Apple","Rohit anand","Disappointed",4
"754","Apple iPhone XR (64GB) - Black",0,0,"url 76","India",2019-10-31,"Best phone so far. Battery backup is unexpectedly huge","5 stars","Apple","Yogesh kumar","Great buy. Osm product",5
"755","Apple iPhone XR (64GB) - Black",2,0,"url 76","India",2019-10-07,"Speaker of this phone is cracked while I received this product","1 star","Apple","meet koyani","I need immediate refund for this product",1
"756","Apple iPhone XR (64GB) - Black",1,0,"url 76","India",2020-03-01,"Nice camera and superb battery life compared to previous models of iPhone. Very happy with my iPhone XR red.","5 stars","Apple","Madhu","iPhone XR👍",5
"757","Apple iPhone XR (64GB) - Black",0,0,"url 76","India",2019-07-31,"Awesome phone and apple tag it self looks so premium in hands and face lock works superb overall happy to buy this phone instead of one plus 7","5 stars","Apple","Kushal shah","Awesome phone apple tag aur kya chahiye",5
"758","Apple iPhone XR (64GB) - Black",0,0,"url 76","India",2019-07-26,"Got the phone for Rs 53,250 in the prime day sale. Used it for 5 days and its the usual apple experience. Good picture, touch and camera quality is excellent considering it has a single camera. Its a bargain at this price bracket.","4 stars","Apple","Anant","iPhone XR 128GB",4
